fullClauseName,text,cause_of_action_1
马鞍山市建筑垃圾管理办法第一条,为加强建筑垃圾管理，维护城市市容和环境卫生，保护和改善生态环境，根据《中华人民共和国固体废物污染环境防治法》《安徽省城市市容和环境卫生管理条例》和有关法律、法规，结合本市实际，制定本办法。,无对应案由
马鞍山市建筑垃圾管理办法第二条,本办法适用于本市城市规划区（花山区、雨山区、马鞍山经济技术开发区、马鞍山慈湖高新技术产业开发区）范围内建筑垃圾的产生、收集、贮存、运输、利用、处置等活动。,无对应案由
马鞍山市建筑垃圾管理办法第三条,本办法所称建筑垃圾，包括工程类建筑垃圾和零星建筑垃圾。工程类建筑垃圾是指建设单位、施工单位新建、改建、扩建和拆除各类建筑物、构筑物、管网或市政工程等施工过程中所产生的弃土、弃料和其它废弃物。零星建筑垃圾，是指道路维修、市政养护、绿化等施工过程或者零星装修和装饰装修房屋过程中产生的弃土、弃料和其它废弃物。,无对应案由
马鞍山市建筑垃圾管理办法第四条,市、区人民政府（含开发园区管委会）应当加强对建筑垃圾管理工作的领导，及时研究解决建筑垃圾管理中的重大事项，建立建筑垃圾分类处理制度，推进建筑垃圾分类收集、分类存放、分类处理，推动建筑垃圾综合利用产品应用，并将建筑垃圾管理工作纳入城市管理综合考核。,无对应案由
马鞍山市建筑垃圾管理办法第五条,城市管理部门是建筑垃圾管理的主管部门。市城市管理部门负责城市规划区内建筑垃圾的管理、监督，核准工程类建筑垃圾处置，制定包括源头减量、分类处理、消纳设施和场所布局及建设等在内的建筑垃圾处置工作规划，推行新型环保智能建筑垃圾运输车及既有车辆更新，依法查处工程类建筑垃圾违法处置行为。花山区、雨山区、马鞍山经济技术开发区、马鞍山慈湖高新技术产业开发区城市管理部门（以下简称“区城市管理部门”）根据建筑垃圾处置工作规划负责本区域内建筑垃圾日常管理，核准零星建筑垃圾处置，加强建筑垃圾消纳（中转）场所日常监管，依法查处零星建筑垃圾违法处置行为。乡镇人民政府、街道办事处应当督促辖区内单位和个人做好建筑垃圾的防治工作，定期组织排查巡查，协助配合调查处理建筑垃圾处置违法行为。,无对应案由
马鞍山市建筑垃圾管理办法第六条,住房城乡建设部门是建筑垃圾资源化再利用主管部门，并负责开发企业、城市住房和建设行业的建筑垃圾源头减量等监管。生态环境部门负责督办建设单位依法办理环境影响评价等相关环保手续，建设项目环评中应有建筑垃圾及建筑施工扬尘防治的内容，配合相关单位进行事中、事后环境监管。自然资源和规划部门负责提供影像资料，配合城市管理部门加强对建筑垃圾消纳场所的监管。公安交警、交通运输、发展改革、经济和信息化、重点工程建设管理、财政等部门按照各自职责，共同做好建筑垃圾管理工作。,无对应案由
马鞍山市建筑垃圾管理办法第七条,建筑垃圾处置遵循减量化、资源化、无害化和谁产生、谁承担处置责任的原则。建设单位发包建设工程，应将建筑垃圾减量化措施费纳入工程概算，并监督设计、施工、监理单位具体落实。,无对应案由
马鞍山市建筑垃圾管理办法第八条,建筑垃圾处置实行收费制度，具体收费按有关规定执行。,无对应案由
马鞍山市建筑垃圾管理办法第九条,运输建筑垃圾的车辆应当采用密闭式工具运输，安装卫星定位系统、行驶及装卸记录仪和相应的建筑垃圾分类运输设备，并纳入建筑垃圾智能监管平台。运输工程类建筑垃圾，推广使用全密闭环保智能建筑垃圾运输车。,无对应案由
马鞍山市建筑垃圾管理办法第十条,实行建筑垃圾运输单位经营许可证制度。申请建筑垃圾运输单位经营许可证应当具备下列条件：（一）依法取得营业执照；（二）有相应的车辆停放场所；（三）依法取得道路运输经营许可证和车辆营运证；（四）具备一定数量符合本办法第九条规定的运输车辆；（五）具备健全的运输车辆运营和安全生产管理制度；（六）法律、法规、规章规定的其他条件。申请零星建筑垃圾运输单位经营许可证应当具备下列条件：（一）依法取得营业执照；（二）有符合本办法第九条规定的运输车辆；（三）法律、法规、规章规定的其他条件。市城市管理部门应当自受理之日起五个工作日作出是否准予许可的决定，不予许可的应当书面告知理由。,无对应案由
马鞍山市建筑垃圾管理办法第十一条,市城市管理部门应当向社会公布已获得行政许可的建筑垃圾运输经营者名录，并提供免费查询服务，接受社会监督。,无对应案由
马鞍山市建筑垃圾管理办法第十二条,实行建筑垃圾处置核准制度，建设单位、施工单位或者建筑垃圾运输单位应当向市城市管理部门或区城市管理部门申请建筑垃圾处置核准证。申请建筑垃圾处置核准证应当提供以下资料：（一）提交书面申请（包括建筑垃圾运输的时间、路线和处置地点名称等）；（二）具有建筑垃圾分类处置方案和对废混凝土、金属、木材等建筑垃圾回收利用的方案；（三）提供与消纳场所签订的建筑垃圾消纳处置合同；（四）与获得行政许可的建筑垃圾运输经营者签署运输协议；（五）法律、法规规定的其他资料。鼓励使用建筑垃圾进行资源化利用，使用建筑垃圾进行回填等资源化利用方式进行处置的，无需签订消纳场所处置协议。城市管理部门应当自受理之日起两个工作日内作出是否核准的决定，不予核准的应当书面告知理由。,无对应案由
马鞍山市建筑垃圾管理办法第十三条,任何单位和个人不得随意倾倒、抛撒、堆放、处置建筑垃圾，不得将建筑垃圾交给未取得建筑垃圾运输经营许可证、建筑垃圾处置核准证的经营者或个人运输。,无对应案由
马鞍山市建筑垃圾管理办法第十四条,任何单位和个人不得将建筑垃圾与生活垃圾、危险废物等进行混合存放、运输和处置。,无对应案由
马鞍山市建筑垃圾管理办法第十五条,施工单位应当加强对建筑工地的管理并采取下列措施：（一）实行建筑垃圾分类管理。施工单位应按工程渣土、混凝土块、砖瓦碎块和其它等四种类型建立建筑垃圾分类收集与存放管理制度，实行分类收集、分类存放、分类处置。（二）减少施工现场建筑垃圾排放。鼓励采用现场泥沙分离、泥浆脱水预处理等工艺，减少工程渣土和工程泥浆排放。（三）在施工现场出入口等部位安装视频监控设备并接入建筑垃圾智能监管平台。（四）施工现场出入口配备洗车槽、车辆冲洗设备和沉淀池，并正常使用。（五）法律、法规、规章要求采取的其他措施。,无对应案由
马鞍山市建筑垃圾管理办法第十六条,施工过程产生零星建筑垃圾的，施工单位应当将施工区域有效隔离，及时处置。确需临时占用街道两侧或公共场所堆放建筑垃圾的，应当到区城市管理部门办理审批手续。村（居）民委员会应当引导村民、居民做好建筑垃圾减量和分类投放工作。物业公司或社区（村民委员会）应当综合考虑便民、交通、建筑垃圾数量等因素，在其管理区域内适当设置零星建筑垃圾临时堆放点，并按本办法的规定及时清运。业主应当将装饰装修房屋中产生的零星建筑垃圾，运至物业公司或社区（村民委员会）指定的临时堆放点统一堆放。无主零星建筑垃圾由所在地的区城市管理部门负责处置。,无对应案由
马鞍山市建筑垃圾管理办法第十七条,运输建筑垃圾，应当遵守下列规定：（一）使用符合本办法规定的车辆运输，接入建筑垃圾智能监管平台并保持正常使用；（二）车辆密闭运输，不得沿途泄漏、遗撒，禁止车轮、车厢带泥行驶；（三）随车携带建筑垃圾处置核准证，按照核定的运输路线和时间行驶；（四）服从场地管理人员指挥，在规定的场所倾卸建筑垃圾；（五）法律、法规及规章的其他规定。,无对应案由
马鞍山市建筑垃圾管理办法第十八条,市城市管理部门应当会同发展改革、自然资源和规划、生态环境、住房城乡建设等部门，根据城市总体规划及国家、省对建筑垃圾管理相关要求，编制建筑垃圾消纳场所专项规划，明确建筑垃圾消纳场所设置布局、规模及建设计划等，报市人民政府批准后实施。编制专项规划应当征求专家和公众的意见，经批准的专项规划纳入城市控制性详细规划。,无对应案由
马鞍山市建筑垃圾管理办法第十九条,建筑垃圾消纳场所的设置，应当符合专项规划。任何单位和个人不得擅自设置建筑垃圾消纳场所。鼓励和支持社会资本参与建设和经营建筑垃圾消纳场所。建立建筑垃圾消纳场所常态化监测机制，消除安全隐患。,无对应案由
马鞍山市建筑垃圾管理办法第二十条,禁止在下列区域设置建筑垃圾消纳场所：（一）基本农田保护区；（二）自然保护区、风景名胜区、森林公园、湿地；（三）饮用水水源保护区；（四）河道、湖泊管理范围内；（五）法律、法规、规章规定的其他区域。,无对应案由
马鞍山市建筑垃圾管理办法第二十一条,建筑垃圾消纳场管理者应当遵守下列规定：（一）不得受纳工业垃圾、生活垃圾和其他有毒有害的垃圾；（二）不得擅自关闭建筑垃圾消纳场所或者拒绝受纳建筑垃圾；（三）实施分区作业，采取围挡、覆盖、喷淋、硬化道路、冲洗等降尘措施；（四）配备摊铺、碾压、降尘、照明、排水、消防等设施设备；（五）纳入建筑垃圾智能监管平台，建立建筑垃圾进场接收和处置台帐，记录入场车辆、消纳数量等情况，并报告城市管理部门；（六）制定防止工程渣土崩滑的工程技术措施，落实环境卫生和安全管理制度，安排专人进行现场管理；（七）法律、法规、规章的其他要求。建筑垃圾消纳场所达到原设计容量或者因其他原因无法继续受纳建筑垃圾的，建筑垃圾消纳场所管理人应当制定封场方案并在停止受纳三十日前报告市城市管理部门。停止受纳后，应当按照封场方案实施封场。,无对应案由
马鞍山市建筑垃圾管理办法第二十二条,大力推进建筑垃圾资源化利用工作，支持优先采用建筑垃圾综合利用产品。鼓励城市道路、公路、铁路的路基施工和海绵城市建设项目优先使用建筑垃圾生产的再生骨料、路基路面材料、砌块、市政工程构配件等新型建材。,无对应案由
马鞍山市建筑垃圾管理办法第二十三条,政府投资项目，在符合技术规范并满足使用功能的前提下，应当优先使用建筑垃圾再生利用产品。,无对应案由
马鞍山市建筑垃圾管理办法第二十四条,任何单位和个人不得伪造、涂改、倒卖、出租、转借或者以其他形式非法转让建筑垃圾处置核准文件。,无对应案由
马鞍山市建筑垃圾管理办法第二十五条,城市管理部门应当会同住房城乡建设、交通运输、公安交警、生态环境等相关部门建立联合执法机制，及时发现和查处建筑垃圾处置违法行为。任何单位和个人发现违反本办法规定处置建筑垃圾的行为，可以向城市管理部门投诉举报。城市管理部门接到投诉举报后，应当依法处理并于五个工作日内向投诉举报人反馈处理结果。,无对应案由
马鞍山市建筑垃圾管理办法第二十六条,城市管理部门会同住房城乡建设、交通运输、公安交警等相关部门建立建筑垃圾智能监管平台，加强对建筑垃圾处置活动的监督管理。相关部门应当按照各自职责向建筑垃圾智能监管平台提供以下信息：（一）城市管理部门提供建筑垃圾处置核准、违法行为查处等方面的信息；（二）住房城乡建设部门提供建设工程施工许可、施工企业诚信记录、施工工地视频监控等方面的信息；（三）交通运输部门提供道路运输许可等方面的信息；（四）公安交警部门提供建筑垃圾运输限行、禁行信息及交通违法行为等方面的信息；（五）其他部门需要提供的信息。,无对应案由
马鞍山市建筑垃圾管理办法第二十七条,城市管理部门应当建立产生、收集、贮存、运输、利用、处置建筑垃圾单位和其他生产经营者信用记录制度，对违法失信的经营者，按照有关规定予以处理。住房城乡建设部门应当将建设单位、施工单位处置建筑垃圾情况纳入建筑业企业信用考核评价体系进行管理。,无对应案由
马鞍山市建筑垃圾管理办法第二十八条,城市管理部门核发建筑垃圾运输经营许可证、建筑垃圾处置核准证等文件，有下列情形之一的，由上级行政机关或者其他有权机关责令纠正，对直接负责的主管人员和其他直接责任人员依法给予行政处分；构成犯罪的，依法追究刑事责任：（一）对不符合法定条件的申请人核发建筑垃圾运输经营许可证、建筑垃圾处置核准证等文件或者超越法定职权核发核准文件的；（二）对符合条件的申请人不予核发建筑垃圾运输经营许可证、建筑垃圾处置核准证等文件或者不在法定期限内核准的。,无对应案由
马鞍山市建筑垃圾管理办法第二十九条,建筑垃圾管理部门的工作人员滥用职权、玩忽职守、徇私舞弊的，依法给予行政处分；涉嫌犯罪的，依法移送司法机关处理。,无对应案由
马鞍山市建筑垃圾管理办法第三十条,违反本办法第十七条规定，有下列行为之一的，由城市管理部门责令改正，按以下规定处罚：（一）车辆密闭不严造成建筑垃圾泄漏、散落或者飞扬的，给予警告，并可处以二百元以上一千元以下罚款；（二）未按照核定的运输路线和时间行驶的，给予警告，并可处以每车一百元以上二百元以下的罚款。,无对应案由
马鞍山市建筑垃圾管理办法第三十一条,违反本办法规定，有下列情形之一的，由城市管理部门责令停止违法行为，限期改正，给予警告，并处以下罚款：（一）违反本办法第十九条、第二十一条规定，擅自设置、关闭建筑垃圾消纳场所，对单位处以五千元以上一万元以下罚款，对个人处以三千元以下罚款；（二）违反本办法第二十一条规定，建筑垃圾消纳场所受纳工业垃圾、生活垃圾、有毒有害垃圾等非建筑垃圾的，处以五千元以上一万元以下罚款。,无对应案由
马鞍山市建筑垃圾管理办法第三十二条,违反本办法规定的行为，法律、法规、部门规章和省政府规章另有处罚规定的，从其规定。,无对应案由
马鞍山市建筑垃圾管理办法第三十三条,含山县、和县、当涂县、博望区参照本办法执行。,无对应案由
马鞍山市建筑垃圾管理办法第三十四条,本办法自2022年12月1日起施行。,无对应案由
